{
  "schemaId": "https://github.com/magicvr/goal-governance/schema/runtime-evidence/v1",
  "format": "goal-governance.host-runtime-evidence",
  "formatVersion": "1.0.0",
  "capturedAt": "2026-07-30T02:50:36.086105Z",
  "unit": {
    "consumer": "grok-build-cli",
    "entrypoint": "audit",
    "protocolVersion": "0.1.0"
  },
  "environment": {
    "product": "Grok Build CLI",
    "version": "0.2.114",
    "platform": "Windows-10-10.0.26200-SP0",
    "provider": "GROK_MODELS_BASE_URL",
    "model": "grok-4.5"
  },
  "behaviorSources": [
    {
      "path": ".grok/skills/audit/SKILL.md",
      "sha256": "65574f7524a43feff8f95052e649f2f8347b7c47fe2f7cdb3ddf208adfcb5146"
    },
    {
      "path": "skills/install/grok/skills/audit/SKILL.md",
      "sha256": "65574f7524a43feff8f95052e649f2f8347b7c47fe2f7cdb3ddf208adfcb5146"
    },
    {
      "path": "skills/prompts/05-independent-audit.md",
      "sha256": "2300c2cfa1181f46ddf9eb44954a4c97647c8ff55e15fa40f442cd9364d9c2d8"
    },
    {
      "path": "AGENTS.md",
      "sha256": "e089f634eacf5ce4f3ef4d45267869ff8d521803788f2e44135be260ed3039b3"
    },
    {
      "path": "docs/workspace-001-goal-governance/GOAL-008-skills-consumer-adapter-release-consistency/attachments/runtime/prompts/grok-audit.txt",
      "sha256": "67fe850d1babad056be374ed4c9890b6bc1813405cbbc0430773b5f9298ab158"
    }
  ],
  "invocation": {
    "command": [
      "grok",
      "--prompt-file",
      "docs/workspace-001-goal-governance/GOAL-008-skills-consumer-adapter-release-consistency/attachments/runtime/prompts/grok-audit.txt",
      "--model",
      "grok-4.5",
      "--output-format",
      "plain",
      "--permission-mode",
      "dontAsk",
      "--disallowed-tools",
      "Edit,Write,NotebookEdit",
      "--max-turns",
      "8",
      "--no-subagents",
      "--no-memory",
      "--disable-web-search"
    ],
    "cwd": ".",
    "timeoutSeconds": 240.0,
    "inputSha256": "67fe850d1babad056be374ed4c9890b6bc1813405cbbc0430773b5f9298ab158",
    "inputSummary": "Read-only /audit dispatch probe requiring marker GROK_AUDIT_DISPATCH_OK after repository-backed skill execution."
  },
  "result": {
    "exitCode": 0,
    "verdict": "pass",
    "marker": "GROK_AUDIT_DISPATCH_OK",
    "markerObserved": true,
    "stdoutPath": "docs/workspace-001-goal-governance/GOAL-008-skills-consumer-adapter-release-consistency/attachments/runtime/grok-build-cli-audit-2026-07-30-refresh.d/stdout.txt",
    "stdoutSha256": "8030f17e9b3dd31081d775c92144d9f42ecce089175f5a6c884ca452d933d070",
    "stdoutMode": "raw",
    "stderrPath": "docs/workspace-001-goal-governance/GOAL-008-skills-consumer-adapter-release-consistency/attachments/runtime/grok-build-cli-audit-2026-07-30-refresh.d/stderr.txt",
    "stderrSha256": "e3b0c44298fc1c149afbf4c8996fb92427ae41e4649b934ca495991b7852b855",
    "stderrMode": "request-url-redacted",
    "warnings": [],
    "reason": "Main process exited 0 and emitted the required marker after the host reported the loaded skill and repository-derived facts."
  },
  "artifacts": {
    "screenshots": []
  }
}
