{
  "schemaId": "https://github.com/magicvr/goal-governance/schema/runtime-evidence/v1",
  "format": "goal-governance.host-runtime-evidence",
  "formatVersion": "1.0.0",
  "capturedAt": "2026-07-28T13:50:51.083625Z",
  "unit": {
    "consumer": "claude-code-cli",
    "entrypoint": "vision-audit",
    "protocolVersion": "0.1.0"
  },
  "environment": {
    "product": "Claude Code CLI",
    "version": "2.1.220",
    "platform": "Windows-11-10.0.26200-SP0",
    "provider": null,
    "model": null
  },
  "behaviorSources": [
    {
      "path": ".claude/skills/vision-audit/SKILL.md",
      "sha256": "09fe4bb5b8d4205986ef2f50e68b5e867eb9c84dc92ab7c51865c0bcace39492"
    },
    {
      "path": "skills/install/claude/skills/vision-audit/SKILL.md",
      "sha256": "a404dbf240f24de81d3df8f39a093b38c563fb50380e6788aa22c60dcd235ea2"
    },
    {
      "path": "skills/prompts/07-independent-vision-review.md",
      "sha256": "c94c3080b507314be809a77a07805210cc2ec80656aaed477ef76c7dc5acf5e2"
    },
    {
      "path": "AGENTS.md",
      "sha256": "5cbcd0f14b3a909f736796dd8f27cfc97eedfcd3b2331c177cc935b7f23d3929"
    },
    {
      "path": "docs/workspace-001-goal-governance/GOAL-008-skills-consumer-adapter-release-consistency/attachments/runtime/prompts/claude-vision-audit.txt",
      "sha256": "151cfa142b24ded516fe7acc8bfcdca2cacd6cd1b8953386726a1a054e64c0a0"
    }
  ],
  "invocation": {
    "command": [
      "cmd.exe",
      "/d",
      "/s",
      "/c",
      "claude -p --no-session-persistence --tools Read,Glob,Grep --permission-mode plan --output-format stream-json --verbose --effort low --max-turns 12"
    ],
    "cwd": ".",
    "timeoutSeconds": 300.0,
    "inputSha256": "ac930cbb046e3e2eadc55fe6dd819e08da086aea741b979d127a2f8737c6be93",
    "inputSummary": "Read-only /vision-audit dispatch probe requiring marker CLAUDE_VISION_AUDIT_DISPATCH_OK after repository-backed skill execution."
  },
  "result": {
    "exitCode": 0,
    "verdict": "pass",
    "marker": "CLAUDE_VISION_AUDIT_DISPATCH_OK",
    "markerObserved": true,
    "stdoutPath": "docs/workspace-001-goal-governance/GOAL-008-skills-consumer-adapter-release-consistency/attachments/runtime/claude-code-cli-vision-audit-2026-07-28.d/stdout.txt",
    "stdoutSha256": "6be19628f1e95447a7b890f128abb8d3f4019526a1031f29d94fbe33af406dfe",
    "stdoutMode": "claude-stream-json-sanitized",
    "stderrPath": "docs/workspace-001-goal-governance/GOAL-008-skills-consumer-adapter-release-consistency/attachments/runtime/claude-code-cli-vision-audit-2026-07-28.d/stderr.txt",
    "stderrSha256": "e3b0c44298fc1c149afbf4c8996fb92427ae41e4649b934ca495991b7852b855",
    "stderrMode": "raw",
    "warnings": [],
    "reason": "Main process exited 0 and emitted the required marker after the host reported the loaded skill and repository-derived facts."
  },
  "artifacts": {
    "screenshots": []
  }
}
