{
  "schemaId": "https://github.com/magicvr/goal-governance/schema/runtime-evidence/v1",
  "format": "goal-governance.host-runtime-evidence",
  "formatVersion": "1.0.0",
  "capturedAt": "2026-07-28T14:13:16.006873Z",
  "unit": {
    "consumer": "github-copilot-cli",
    "entrypoint": "vision-audit",
    "protocolVersion": "0.1.0"
  },
  "environment": {
    "product": "GitHub Copilot CLI",
    "version": "1.0.75",
    "platform": "Windows-11-10.0.26200-SP0",
    "provider": "COPILOT_PROVIDER_BASE_URL",
    "model": "grok-4.5"
  },
  "behaviorSources": [
    {
      "path": "AGENTS.md",
      "sha256": "5cbcd0f14b3a909f736796dd8f27cfc97eedfcd3b2331c177cc935b7f23d3929"
    },
    {
      "path": ".github/copilot-instructions.md",
      "sha256": "c235aef254ffe175e96b2951fb2faf3cc5d196619dc3954d00413fb6655c1a5e"
    },
    {
      "path": ".github/prompts/vision-audit.prompt.md",
      "sha256": "c694b6bf13aa9cf4fe3a63b7949d89d89f6ef6745ea222c0f0254a112704415f"
    },
    {
      "path": "skills/prompts/07-independent-vision-review.md",
      "sha256": "c94c3080b507314be809a77a07805210cc2ec80656aaed477ef76c7dc5acf5e2"
    },
    {
      "path": "docs/workspace-001-goal-governance/GOAL-008-skills-consumer-adapter-release-consistency/attachments/runtime/prompts/copilot-cli-replay.ps1",
      "sha256": "eec363bf8ba6ccf8b8db86078643736e4d2767be99feabfef68ec1a14919d807"
    },
    {
      "path": "docs/workspace-001-goal-governance/GOAL-008-skills-consumer-adapter-release-consistency/attachments/runtime/prompts/copilot-cli-vision-audit.txt",
      "sha256": "e21c479476ced6ae687cb6ba238c92a20afe713a645b16d637793474f9c9901a"
    }
  ],
  "invocation": {
    "command": [
      "powershell.exe",
      "-NoProfile",
      "-NonInteractive",
      "-File",
      "docs/workspace-001-goal-governance/GOAL-008-skills-consumer-adapter-release-consistency/attachments/runtime/prompts/copilot-cli-replay.ps1"
    ],
    "cwd": ".",
    "timeoutSeconds": 300.0,
    "inputSha256": "ed5096e7a27ba657366546a06bb3f8bab18252330887a8aa396f069ebda52813",
    "inputSummary": "Read-only /vision-audit dispatch probe requiring marker COPILOT_CLI_VISION_AUDIT_DISPATCH_OK after repository-backed skill execution."
  },
  "result": {
    "exitCode": 0,
    "verdict": "pass",
    "marker": "COPILOT_CLI_VISION_AUDIT_DISPATCH_OK",
    "markerObserved": true,
    "stdoutPath": "docs/workspace-001-goal-governance/GOAL-008-skills-consumer-adapter-release-consistency/attachments/runtime/copilot-cli-vision-audit-2026-07-28-byok-auth.d/stdout.txt",
    "stdoutSha256": "1c480f2e657a99bab3b54f03c28e68bb231cb6cf1a9f77ed49257dfe7b62d317",
    "stdoutMode": "raw",
    "stderrPath": "docs/workspace-001-goal-governance/GOAL-008-skills-consumer-adapter-release-consistency/attachments/runtime/copilot-cli-vision-audit-2026-07-28-byok-auth.d/stderr.txt",
    "stderrSha256": "c92fe3083faea5a522bb934d9d919e25ffb7b0c88530884c074f9f4bdb05e09e",
    "stderrMode": "raw",
    "warnings": [],
    "reason": "Main process exited 0 and emitted the required marker after the host reported the loaded skill and repository-derived facts."
  },
  "artifacts": {
    "screenshots": []
  }
}
