{
  "schemaId": "https://github.com/magicvr/goal-governance/schema/runtime-evidence/v1",
  "format": "goal-governance.host-runtime-evidence",
  "formatVersion": "1.0.0",
  "capturedAt": "2026-07-28T02:58:08.485724Z",
  "unit": {
    "consumer": "claude-code-cli",
    "entrypoint": "audit",
    "protocolVersion": "0.1.0"
  },
  "environment": {
    "product": "Claude Code CLI",
    "version": "2.1.220",
    "platform": "Windows-10-10.0.26200-SP0",
    "provider": null,
    "model": null
  },
  "behaviorSources": [
    {
      "path": ".claude/skills/audit/SKILL.md",
      "sha256": "e22543fa3d236cc1f7ecf70b23cf7bd77a87f15adcbd07e077ea95cc57eed651"
    },
    {
      "path": "skills/install/claude/skills/audit/SKILL.md",
      "sha256": "e22543fa3d236cc1f7ecf70b23cf7bd77a87f15adcbd07e077ea95cc57eed651"
    },
    {
      "path": "skills/prompts/05-independent-audit.md",
      "sha256": "1f349da1fe03970d56ad357fbb8b185b10845570f4031f081b64eeb7ac1e721c"
    },
    {
      "path": "AGENTS.md",
      "sha256": "4588109ccee1f2e09a08d57f3093d2ca46adec7e8320b68f07f0fb50063e035a"
    },
    {
      "path": "docs/workspace-001-goal-governance/GOAL-008-skills-consumer-adapter-release-consistency/attachments/runtime/prompts/claude-audit.txt",
      "sha256": "26c76060bf2b58f9da2947d834db1bcf2e9100a8b927c3fce33c2fb36eee7bd6"
    }
  ],
  "invocation": {
    "command": [
      "cmd.exe",
      "/d",
      "/s",
      "/c",
      "claude -p --no-session-persistence --tools Read,Glob,Grep --permission-mode plan --output-format stream-json --verbose --effort low --max-turns 15"
    ],
    "cwd": ".",
    "timeoutSeconds": 360.0,
    "inputSha256": "26c76060bf2b58f9da2947d834db1bcf2e9100a8b927c3fce33c2fb36eee7bd6",
    "inputSummary": "Read-only /audit dispatch probe requiring marker CLAUDE_AUDIT_DISPATCH_OK after repository-backed skill execution."
  },
  "result": {
    "exitCode": 0,
    "verdict": "pass",
    "marker": "CLAUDE_AUDIT_DISPATCH_OK",
    "markerObserved": true,
    "stdoutPath": "docs/workspace-001-goal-governance/GOAL-008-skills-consumer-adapter-release-consistency/attachments/runtime/claude-code-cli-audit-2026-07-28.d/stdout.txt",
    "stdoutSha256": "a33c595a2813189319dd136090529476ef7d4dd0f4993189dba578460ef2b35d",
    "stdoutMode": "claude-stream-json-sanitized",
    "stderrPath": "docs/workspace-001-goal-governance/GOAL-008-skills-consumer-adapter-release-consistency/attachments/runtime/claude-code-cli-audit-2026-07-28.d/stderr.txt",
    "stderrSha256": "e3b0c44298fc1c149afbf4c8996fb92427ae41e4649b934ca495991b7852b855",
    "stderrMode": "raw",
    "warnings": [],
    "reason": "Main process exited 0 and emitted the required marker after the host reported the loaded skill and repository-derived facts."
  },
  "artifacts": {
    "screenshots": []
  }
}
