{
  "schemaId": "https://github.com/magicvr/goal-governance/schema/runtime-evidence/v1",
  "format": "goal-governance.host-runtime-evidence",
  "formatVersion": "1.0.0",
  "capturedAt": "2026-07-24T11:38:05.027215Z",
  "unit": {
    "consumer": "github-copilot-cli",
    "entrypoint": "govern",
    "protocolVersion": "0.1.0"
  },
  "environment": {
    "product": "GitHub Copilot CLI",
    "version": "1.0.71",
    "platform": "Windows-10-10.0.26200-SP0",
    "provider": null,
    "model": null
  },
  "behaviorSources": [
    {
      "path": "AGENTS.md",
      "sha256": "eb524280a8188498f765aa0f2d54ef3df65c5e571bd7fa6ecb3ed267b3ed6984"
    },
    {
      "path": ".github/copilot-instructions.md",
      "sha256": "e56dd2e5904f1467a4bc1c22a8b54c3430dcbad7a58f33cbab0a0fc7036b5381"
    },
    {
      "path": "skills/prompts/00-govern-orchestrator.md",
      "sha256": "9d1230c6608335ded1a01af0b4b854f7a6cba6b17e1412e907ae459ec70af329"
    },
    {
      "path": "docs/workspace-001-goal-governance/GOAL-008-skills-consumer-adapter-release-consistency/attachments/runtime/prompts/copilot-cli-replay.ps1",
      "sha256": "759d7da95b222109554452e8a582cb038c3710d6572e167b4ebbad640871ab91"
    },
    {
      "path": "docs/workspace-001-goal-governance/GOAL-008-skills-consumer-adapter-release-consistency/attachments/runtime/prompts/copilot-cli-govern.txt",
      "sha256": "3b51788eed53ffa6a2733073a7173d1bdf07942e2940b206d4198a59a266937d"
    }
  ],
  "invocation": {
    "command": [
      "powershell.exe",
      "-NoProfile",
      "-NonInteractive",
      "-File",
      "docs/workspace-001-goal-governance/GOAL-008-skills-consumer-adapter-release-consistency/attachments/runtime/prompts/copilot-cli-replay.ps1"
    ],
    "cwd": ".",
    "timeoutSeconds": 240.0,
    "inputSha256": "3b51788eed53ffa6a2733073a7173d1bdf07942e2940b206d4198a59a266937d",
    "inputSummary": "Read-only /govern dispatch probe requiring marker COPILOT_CLI_GOVERN_DISPATCH_OK after repository-backed skill execution."
  },
  "result": {
    "exitCode": 0,
    "verdict": "pass",
    "marker": "COPILOT_CLI_GOVERN_DISPATCH_OK",
    "markerObserved": true,
    "stdoutPath": "docs/workspace-001-goal-governance/GOAL-008-skills-consumer-adapter-release-consistency/attachments/runtime/copilot-cli-govern-2026-07-24.d/stdout.txt",
    "stdoutSha256": "5cf7a5b59a8f0561e4eac3178efff2422b36468113cde50d77b24554169a8f1e",
    "stdoutMode": "raw",
    "stderrPath": "docs/workspace-001-goal-governance/GOAL-008-skills-consumer-adapter-release-consistency/attachments/runtime/copilot-cli-govern-2026-07-24.d/stderr.txt",
    "stderrSha256": "2d0830a8891a42430d1bc7ac14352a03e5d1bf26c0c957d7f8ef976d107c6bbe",
    "stderrMode": "raw",
    "warnings": [],
    "reason": "Main process exited 0 and emitted the required marker after the host reported the loaded skill and repository-derived facts."
  },
  "artifacts": {
    "screenshots": []
  }
}
