{
  "schemaId": "https://github.com/magicvr/goal-governance/schema/runtime-evidence/v1",
  "format": "goal-governance.host-runtime-evidence",
  "formatVersion": "1.0.0",
  "capturedAt": "2026-07-24T12:46:16.419628Z",
  "unit": {
    "consumer": "grok-build-cli",
    "entrypoint": "govern",
    "protocolVersion": "0.1.0"
  },
  "environment": {
    "product": "Grok Build CLI",
    "version": "grok 0.2.111 (94172f2aa4)",
    "platform": "Windows-10-10.0.26200-SP0",
    "provider": "GROK_MODELS_BASE_URL",
    "model": "grok-4.5"
  },
  "behaviorSources": [
    {
      "path": ".grok/skills/govern/SKILL.md",
      "sha256": "042191e880504b67195446ff4b85bea6a17880a023c95d35430383739321a194"
    },
    {
      "path": "skills/install/grok/skills/govern/SKILL.md",
      "sha256": "042191e880504b67195446ff4b85bea6a17880a023c95d35430383739321a194"
    },
    {
      "path": "skills/prompts/00-govern-orchestrator.md",
      "sha256": "9d1230c6608335ded1a01af0b4b854f7a6cba6b17e1412e907ae459ec70af329"
    },
    {
      "path": "AGENTS.md",
      "sha256": "eb524280a8188498f765aa0f2d54ef3df65c5e571bd7fa6ecb3ed267b3ed6984"
    },
    {
      "path": "docs/workspace-001-goal-governance/GOAL-008-skills-consumer-adapter-release-consistency/attachments/runtime/prompts/grok-govern.txt",
      "sha256": "a2764b2f7692a86b6ca7a847753f936c2b0ca4c3d28ea8fef701c3ba55c1f5e4"
    }
  ],
  "invocation": {
    "command": [
      "grok",
      "--prompt-file",
      "docs/workspace-001-goal-governance/GOAL-008-skills-consumer-adapter-release-consistency/attachments/runtime/prompts/grok-govern.txt",
      "--model",
      "grok-4.5",
      "--output-format",
      "plain",
      "--permission-mode",
      "dontAsk",
      "--disallowed-tools",
      "Edit,Write,NotebookEdit",
      "--max-turns",
      "10",
      "--no-subagents",
      "--no-memory",
      "--disable-web-search"
    ],
    "cwd": ".",
    "timeoutSeconds": 300.0,
    "inputSha256": "a2764b2f7692a86b6ca7a847753f936c2b0ca4c3d28ea8fef701c3ba55c1f5e4",
    "inputSummary": "Read-only /govern dispatch probe requiring marker GROK_GOVERN_DISPATCH_OK after repository-backed skill execution."
  },
  "result": {
    "exitCode": 0,
    "verdict": "pass",
    "marker": "GROK_GOVERN_DISPATCH_OK",
    "markerObserved": true,
    "stdoutPath": "docs/workspace-001-goal-governance/GOAL-008-skills-consumer-adapter-release-consistency/attachments/runtime/grok-build-cli-govern-2026-07-24.d/stdout.txt",
    "stdoutSha256": "6242a70a49044c93f5792292b33aaec2fd9dddc5a79171394163ae234844df0e",
    "stdoutMode": "raw",
    "stderrPath": "docs/workspace-001-goal-governance/GOAL-008-skills-consumer-adapter-release-consistency/attachments/runtime/grok-build-cli-govern-2026-07-24.d/stderr.txt",
    "stderrSha256": "e3b0c44298fc1c149afbf4c8996fb92427ae41e4649b934ca495991b7852b855",
    "stderrMode": "request-url-redacted",
    "warnings": [],
    "reason": "Main process exited 0 and emitted the required marker after the host reported the loaded skill and repository-derived facts."
  },
  "artifacts": {
    "screenshots": []
  }
}
