{
  "schemaId": "https://github.com/magicvr/goal-governance/schema/runtime-evidence/v1",
  "format": "goal-governance.host-runtime-evidence",
  "formatVersion": "1.0.0",
  "capturedAt": "2026-07-28T14:32:34.734177Z",
  "unit": {
    "consumer": "github-copilot-cli",
    "entrypoint": "audit",
    "protocolVersion": "0.1.0"
  },
  "environment": {
    "product": "GitHub Copilot CLI",
    "version": "1.0.75",
    "platform": "Windows-11-10.0.26200-SP0",
    "provider": "COPILOT_PROVIDER_BASE_URL",
    "model": "grok-4.5"
  },
  "behaviorSources": [
    {
      "path": "AGENTS.md",
      "sha256": "5cbcd0f14b3a909f736796dd8f27cfc97eedfcd3b2331c177cc935b7f23d3929"
    },
    {
      "path": ".github/copilot-instructions.md",
      "sha256": "c235aef254ffe175e96b2951fb2faf3cc5d196619dc3954d00413fb6655c1a5e"
    },
    {
      "path": "skills/prompts/05-independent-audit.md",
      "sha256": "6f0f42e963fb869ae93cb41523b094756e398f3175cd8db0843a731ea8bd79ea"
    },
    {
      "path": "docs/workspace-001-goal-governance/GOAL-008-skills-consumer-adapter-release-consistency/attachments/runtime/prompts/copilot-cli-replay.ps1",
      "sha256": "eec363bf8ba6ccf8b8db86078643736e4d2767be99feabfef68ec1a14919d807"
    },
    {
      "path": "docs/workspace-001-goal-governance/GOAL-008-skills-consumer-adapter-release-consistency/attachments/runtime/prompts/copilot-cli-audit.txt",
      "sha256": "64b43ab10c2266fb753d3d98c02164969e91188c9b97bb66c28a102b724eed92"
    }
  ],
  "invocation": {
    "command": [
      "powershell.exe",
      "-NoProfile",
      "-NonInteractive",
      "-File",
      "docs/workspace-001-goal-governance/GOAL-008-skills-consumer-adapter-release-consistency/attachments/runtime/prompts/copilot-cli-replay.ps1"
    ],
    "cwd": ".",
    "timeoutSeconds": 300.0,
    "inputSha256": "64b43ab10c2266fb753d3d98c02164969e91188c9b97bb66c28a102b724eed92",
    "inputSummary": "Read-only /audit dispatch probe requiring marker COPILOT_CLI_AUDIT_DISPATCH_OK after repository-backed skill execution."
  },
  "result": {
    "exitCode": 0,
    "verdict": "pass",
    "marker": "COPILOT_CLI_AUDIT_DISPATCH_OK",
    "markerObserved": true,
    "stdoutPath": "docs/workspace-001-goal-governance/GOAL-008-skills-consumer-adapter-release-consistency/attachments/runtime/copilot-cli-audit-2026-07-28-refresh.d/stdout.txt",
    "stdoutSha256": "5bb975199bab4138cf6f9644c5af69aa8f1e7671345f7fcb398b395c51fb42c5",
    "stdoutMode": "raw",
    "stderrPath": "docs/workspace-001-goal-governance/GOAL-008-skills-consumer-adapter-release-consistency/attachments/runtime/copilot-cli-audit-2026-07-28-refresh.d/stderr.txt",
    "stderrSha256": "670473992b8df0fdfc84c2e0a613ad7750dea9505b9f9527bb219287666c4f62",
    "stderrMode": "raw",
    "warnings": [],
    "reason": "Main process exited 0 and emitted the required marker after the host reported the loaded skill and repository-derived facts."
  },
  "artifacts": {
    "screenshots": []
  }
}
