{
  "schemaId": "https://github.com/magicvr/goal-governance/schema/runtime-evidence/v1",
  "format": "goal-governance.host-runtime-evidence",
  "formatVersion": "1.0.0",
  "capturedAt": "2026-07-24T11:40:05.041608Z",
  "unit": {
    "consumer": "github-copilot-cli",
    "entrypoint": "audit",
    "protocolVersion": "0.1.0"
  },
  "environment": {
    "product": "GitHub Copilot CLI",
    "version": "1.0.71",
    "platform": "Windows-10-10.0.26200-SP0",
    "provider": null,
    "model": null
  },
  "behaviorSources": [
    {
      "path": "AGENTS.md",
      "sha256": "eb524280a8188498f765aa0f2d54ef3df65c5e571bd7fa6ecb3ed267b3ed6984"
    },
    {
      "path": ".github/copilot-instructions.md",
      "sha256": "e56dd2e5904f1467a4bc1c22a8b54c3430dcbad7a58f33cbab0a0fc7036b5381"
    },
    {
      "path": "skills/prompts/05-independent-audit.md",
      "sha256": "6273660f7bab9387d823c48301b5dfcd918119edc07269a97c0cd774e11d2a35"
    },
    {
      "path": "docs/workspace-001-goal-governance/GOAL-008-skills-consumer-adapter-release-consistency/attachments/runtime/prompts/copilot-cli-replay.ps1",
      "sha256": "759d7da95b222109554452e8a582cb038c3710d6572e167b4ebbad640871ab91"
    },
    {
      "path": "docs/workspace-001-goal-governance/GOAL-008-skills-consumer-adapter-release-consistency/attachments/runtime/prompts/copilot-cli-audit.txt",
      "sha256": "64b43ab10c2266fb753d3d98c02164969e91188c9b97bb66c28a102b724eed92"
    }
  ],
  "invocation": {
    "command": [
      "powershell.exe",
      "-NoProfile",
      "-NonInteractive",
      "-File",
      "docs/workspace-001-goal-governance/GOAL-008-skills-consumer-adapter-release-consistency/attachments/runtime/prompts/copilot-cli-replay.ps1"
    ],
    "cwd": ".",
    "timeoutSeconds": 240.0,
    "inputSha256": "64b43ab10c2266fb753d3d98c02164969e91188c9b97bb66c28a102b724eed92",
    "inputSummary": "Read-only /audit dispatch probe requiring marker COPILOT_CLI_AUDIT_DISPATCH_OK after repository-backed skill execution."
  },
  "result": {
    "exitCode": 0,
    "verdict": "pass",
    "marker": "COPILOT_CLI_AUDIT_DISPATCH_OK",
    "markerObserved": true,
    "stdoutPath": "docs/workspace-001-goal-governance/GOAL-008-skills-consumer-adapter-release-consistency/attachments/runtime/copilot-cli-audit-2026-07-24.d/stdout.txt",
    "stdoutSha256": "0e89b938f81a18e55588bfef0a1e408b24d056b652cfc1ae30660d28cd004fa7",
    "stdoutMode": "raw",
    "stderrPath": "docs/workspace-001-goal-governance/GOAL-008-skills-consumer-adapter-release-consistency/attachments/runtime/copilot-cli-audit-2026-07-24.d/stderr.txt",
    "stderrSha256": "574d26fbf3ebf74b273728c3fc2a52a5e392ef5888cfc727cda19f181cb31a45",
    "stderrMode": "raw",
    "warnings": [],
    "reason": "Main process exited 0 and emitted the required marker after the host reported the loaded skill and repository-derived facts."
  },
  "artifacts": {
    "screenshots": []
  }
}
