{
  "schemaId": "https://github.com/magicvr/goal-governance/schema/runtime-evidence/v1",
  "format": "goal-governance.host-runtime-evidence",
  "formatVersion": "1.0.0",
  "capturedAt": "2026-07-30T02:51:06.100957Z",
  "unit": {
    "consumer": "grok-build-cli",
    "entrypoint": "vision",
    "protocolVersion": "0.1.0"
  },
  "environment": {
    "product": "Grok Build CLI",
    "version": "0.2.114",
    "platform": "Windows-10-10.0.26200-SP0",
    "provider": "GROK_MODELS_BASE_URL",
    "model": "grok-4.5"
  },
  "behaviorSources": [
    {
      "path": ".grok/skills/vision/SKILL.md",
      "sha256": "2851f037865ba9db25c40fb145bcf785862ee284c4c391faebf1d06804f47d39"
    },
    {
      "path": "skills/install/grok/skills/vision/SKILL.md",
      "sha256": "2851f037865ba9db25c40fb145bcf785862ee284c4c391faebf1d06804f47d39"
    },
    {
      "path": "skills/prompts/06-vision-orchestrator.md",
      "sha256": "54c6ba619646f4e1a9b20560fd02a1a7dec9369dd824174882b6b72bcaf95123"
    },
    {
      "path": "AGENTS.md",
      "sha256": "aa33e626cb072bf84fd06a16db6ebb66830c9e8a58a9445a8f360e508e0a7f68"
    },
    {
      "path": "docs/workspace-001-goal-governance/GOAL-008-skills-consumer-adapter-release-consistency/attachments/runtime/prompts/grok-vision.txt",
      "sha256": "1a1c855921be711919811ccd829ce25d2713f123ee9cee4459e4d6bc3c203e99"
    }
  ],
  "invocation": {
    "command": [
      "grok",
      "--prompt-file",
      "docs/workspace-001-goal-governance/GOAL-008-skills-consumer-adapter-release-consistency/attachments/runtime/prompts/grok-vision.txt",
      "--model",
      "grok-4.5",
      "--output-format",
      "plain",
      "--permission-mode",
      "dontAsk",
      "--disallowed-tools",
      "Edit,Write,NotebookEdit",
      "--max-turns",
      "10",
      "--no-subagents",
      "--no-memory",
      "--disable-web-search"
    ],
    "cwd": ".",
    "timeoutSeconds": 240.0,
    "inputSha256": "1a1c855921be711919811ccd829ce25d2713f123ee9cee4459e4d6bc3c203e99",
    "inputSummary": "Read-only /vision dispatch probe requiring marker GROK_VISION_DISPATCH_OK after repository-backed skill execution."
  },
  "result": {
    "exitCode": 0,
    "verdict": "pass",
    "marker": "GROK_VISION_DISPATCH_OK",
    "markerObserved": true,
    "stdoutPath": "docs/workspace-001-goal-governance/GOAL-008-skills-consumer-adapter-release-consistency/attachments/runtime/grok-build-cli-vision-2026-07-30-refresh.d/stdout.txt",
    "stdoutSha256": "8052f2b9795879f962144bd9ac8944d44adbc2df71fedfe403ea25087cc5f9ae",
    "stdoutMode": "raw",
    "stderrPath": "docs/workspace-001-goal-governance/GOAL-008-skills-consumer-adapter-release-consistency/attachments/runtime/grok-build-cli-vision-2026-07-30-refresh.d/stderr.txt",
    "stderrSha256": "e3b0c44298fc1c149afbf4c8996fb92427ae41e4649b934ca495991b7852b855",
    "stderrMode": "request-url-redacted",
    "warnings": [],
    "reason": "Main process exited 0 and emitted the required marker after the host reported the loaded skill and repository-derived facts."
  },
  "artifacts": {
    "screenshots": []
  }
}
