{
  "schemaId": "https://github.com/magicvr/goal-governance/schema/runtime-evidence/v1",
  "format": "goal-governance.host-runtime-evidence",
  "formatVersion": "1.0.0",
  "capturedAt": "2026-07-30T02:49:06.053513Z",
  "unit": {
    "consumer": "claude-code-cli",
    "entrypoint": "vision",
    "protocolVersion": "0.1.0"
  },
  "environment": {
    "product": "Claude Code CLI",
    "version": "2.1.220",
    "platform": "Windows-10-10.0.26200-SP0",
    "provider": null,
    "model": null
  },
  "behaviorSources": [
    {
      "path": ".claude/skills/vision/SKILL.md",
      "sha256": "746fad9b96e5b17ab26ff3809d8fe56ea6910aafc8119284816ddf40c2d81c7d"
    },
    {
      "path": "skills/install/claude/skills/vision/SKILL.md",
      "sha256": "746fad9b96e5b17ab26ff3809d8fe56ea6910aafc8119284816ddf40c2d81c7d"
    },
    {
      "path": "skills/prompts/06-vision-orchestrator.md",
      "sha256": "54c6ba619646f4e1a9b20560fd02a1a7dec9369dd824174882b6b72bcaf95123"
    },
    {
      "path": "AGENTS.md",
      "sha256": "e089f634eacf5ce4f3ef4d45267869ff8d521803788f2e44135be260ed3039b3"
    },
    {
      "path": "docs/workspace-001-goal-governance/GOAL-008-skills-consumer-adapter-release-consistency/attachments/runtime/prompts/claude-vision.txt",
      "sha256": "3f527e82cbe0e557eb981a95670d9348a9afbd14a7ffadeff69c9fe524a3d3b6"
    }
  ],
  "invocation": {
    "command": [
      "cmd.exe",
      "/d",
      "/s",
      "/c",
      "claude -p --no-session-persistence --tools Read,Glob,Grep --permission-mode plan --output-format stream-json --verbose --effort low --max-turns 12"
    ],
    "cwd": ".",
    "timeoutSeconds": 240.0,
    "inputSha256": "3f527e82cbe0e557eb981a95670d9348a9afbd14a7ffadeff69c9fe524a3d3b6",
    "inputSummary": "Read-only /vision dispatch probe requiring marker CLAUDE_VISION_DISPATCH_OK after repository-backed skill execution."
  },
  "result": {
    "exitCode": 0,
    "verdict": "pass",
    "marker": "CLAUDE_VISION_DISPATCH_OK",
    "markerObserved": true,
    "stdoutPath": "docs/workspace-001-goal-governance/GOAL-008-skills-consumer-adapter-release-consistency/attachments/runtime/claude-code-cli-vision-2026-07-30-refresh.d/stdout.txt",
    "stdoutSha256": "7fb5dccfae1e47f38a26a650b4a3267b94e3a7ae210cfd741fa23a5160d8248e",
    "stdoutMode": "claude-stream-json-sanitized",
    "stderrPath": "docs/workspace-001-goal-governance/GOAL-008-skills-consumer-adapter-release-consistency/attachments/runtime/claude-code-cli-vision-2026-07-30-refresh.d/stderr.txt",
    "stderrSha256": "e3b0c44298fc1c149afbf4c8996fb92427ae41e4649b934ca495991b7852b855",
    "stderrMode": "raw",
    "warnings": [],
    "reason": "Main process exited 0 and emitted the required marker after the host reported the loaded skill and repository-derived facts."
  },
  "artifacts": {
    "screenshots": []
  }
}
